{"empty_state":{"entities":[],"ledger_commands":[],"outbox_events":[]},"format":"ir-empty-scaffold-v1","idempotency_key":"synthetic-request-null-provenance","policy":{"format":"ir-portable-policy-v1","policy":{"attribution":{"allowed_methods":["DIRECT_RESTRICTED","PRO_RATA_POOL","FIFO_ALLOCATION","COHORT_ALLOCATION","ASSET_SPONSORSHIP","EXPENSE_BACKED","MANUAL_APPROVED"],"default_method":"DIRECT_RESTRICTED"},"authority":{"l3_command_types":["approve_expense","reject_expense","publish_use_of_funds_receipt","send_notification","publish_public_evidence","change_attribution_policy","correct_published_amount","reverse_expense","supersede_expense"]},"confidence":{"block_below":"0.75","recommend_high":"0.95"},"display_name":"Synthetic portable scaffold","evidence":{"require_donor_visible":true,"sufficient_kinds":["invoice","receipt","accounting_ref"]},"notifications":{"default_email_topics":["MONEY_USED","CORRECTION"],"fixture_consent_allowed":true,"require_separate_send_approval":true},"source_path":null,"tenant_id":"org_synthetic_portable","version":"v1"}},"policy_sha256":"db1d7581730a536a9c32f6362c96d3ce1897ba8655b5cb25a7fca1fd96003f9f","readiness":{"operational":false,"scaffold_verified":false},"tenant_id":"org_synthetic_portable"}