{"empty_state":{"entities":[],"ledger_commands":[],"outbox_events":[]},"format":"ir-empty-scaffold-v1","idempotency_key":"synthetic-request-unicode-empty","policy":{"format":"ir-portable-policy-v1","policy":{"attribution":{"allowed_methods":["DIRECT_RESTRICTED","PRO_RATA_POOL","FIFO_ALLOCATION","COHORT_ALLOCATION","ASSET_SPONSORSHIP","EXPENSE_BACKED","MANUAL_APPROVED"],"default_method":"DIRECT_RESTRICTED"},"authority":{"l3_command_types":["approve_expense","reject_expense","publish_use_of_funds_receipt","send_notification","publish_public_evidence","change_attribution_policy","correct_published_amount","reverse_expense","supersede_expense"]},"confidence":{"block_below":"0.75","recommend_high":"0.95"},"display_name":"Synthetic café 🌱\n\"quoted\"\\","evidence":{"require_donor_visible":true,"sufficient_kinds":[]},"notifications":{"default_email_topics":[],"fixture_consent_allowed":false,"require_separate_send_approval":true},"source_path":"fixture:public/不存在.yaml","tenant_id":"org_synthetic_unicode","version":"v1"}},"policy_sha256":"7f0cdabc57e0fd9b88af2cf3546db468ac09aa9b2eae9063b0dbd9c56749081b","readiness":{"operational":false,"scaffold_verified":false},"tenant_id":"org_synthetic_unicode"}